[
  {
    "recordId": "example-rev-001",
    "courseId": "example-sample-course",
    "assignmentId": "example-past-graded-quiz-01",
    "questionFingerprint": "0123456789abcdef0123456789abcdef0123456789abcdef0123456789abcdef",
    "normalizedQuestionText": "what is the principal condition for market equilibrium",
    "options": [
      "Quantity supplied equals quantity demanded",
      "Price equals zero",
      "Supply exceeds demand"
    ],
    "explanation": "Equilibrium occurs where quantity supplied matches quantity demanded, leaving no shortage or surplus.",
    "verificationStatus": "portal-confirmed",
    "verificationSource": "portal_archived_graded_feedback",
    "releaseTimestamp": "2025-01-01T00:00:00Z",
    "redistributionPermission": "Explicitly released by instructor for open exam review.",
    "recordVersion": "1.0.0",
    "isReleased": true,
    "provenance": {
      "sourceTitle": "Example Official Released Assessment Archive",
      "sourceUrl": "https://example.org/released-feedback/quiz1",
      "authorOrPublisher": "Example Instructor Team",
      "license": "Educational Review",
      "attribution": "Publicly released test feedback.",
      "retrievalDate": "2026-01-01T00:00:00Z"
    }
  }
]
